title,paragraph
Charles Ives,"Charles Edward Ives (/aɪvz/; October 20, 1874 – May 19, 1954) was an American modernist composer,[1] one of the first American composers of international renown.[2] His music was largely ignored during his early career, and many of his works went unperformed for many years. Later in life, the quality of his music was publicly recognized through the efforts of contemporaries like Henry Cowell and Lou Harrison, and he came to be regarded as an ""American original"".[3][4][5] He was also among the first composers to engage in a systematic program of experimental music, with musical techniques including polytonality, polyrhythm, tone clusters, aleatory elements, and quarter tones.[6] His experimentation foreshadowed many musical innovations that were later more widely adopted during the 20th century. Hence, he is often regarded as the leading American composer of art music of the 20th century.[7]"
Friedrich Wilhelm Jähns,"Friedrich Wilhelm Jähns (German: [jɛːns]; 2 January 1809 – 8 August 1888) was a German music scholar, voice teacher, and composer. He is best known for his chronological catalog of the works of Carl Maria von Weber."
Nicolas Isouard,"Nicolas Isouard (also known as Nicolò, Nicolò Isoiar or Nicolò de Malte;[1] 18 May 1773 – 23 March 1818) was a Maltese-born French composer."
John Ireland (composer),"John Nicholson Ireland (13 August 1879 – 12 June 1962)[1] was an English composer and teacher of music. The majority of his output consists of piano miniatures and of songs with piano. His best-known works include the short instrumental or orchestral work ""The Holy Boy"", a setting of the poem ""Sea-Fever"" by John Masefield, a formerly much-played Piano Concerto, the hymn tune Love Unknown and the choral motet ""Greater Love Hath No Man""."
Feliks Janiewicz,"Feliks Janiewicz, in English often Felix Yaniewicz (1762 – 21 May 1848) was a Polish composer and violinist in exile."
Natalia Janotha,Natalia Janotha (8 June 1856 – 9 June 1932) was a Polish pianist and composer.
Leopold Jansa,"Leopold Jansa (23 March 1795, Wildenschwert (Czech: Ústí nad Orlicí), far north-east Bohemia, Austrian Empire – 25 January 1875, Vienna) was a Bohemian violinist, composer, and teacher."
Leoš Janáček,"Leoš Janáček (Czech: [ˈlɛoʃ ˈjanaːtʃɛk] (listen),[1] baptised Leo Eugen Janáček; 3 July 1854 – 12 August 1928) was a Czech composer, musical theorist, folklorist, publicist, and teacher. He was inspired by Moravian and other Slavic musics, including Eastern European folk music, to create an original, modern musical style.[2]"
Émile Jaques-Dalcroze,"Émile Jaques-Dalcroze (6 July 1865 – 1 July 1950) was a Swiss composer, musician, and music educator who developed Dalcroze eurhythmics, an approach to learning and experiencing music through movement. Dalcroze eurhythmics influenced Carl Orff's pedagogy, used in music education throughout the United States.[citation needed]"
Georg Jarno,"Georg Jarno (3 June 1868, in Buda – 25 May 1920, in Breslau) was a Hungarian composer, mainly of operettas."
Ezra Jenkinson,"Ezra Jenkinson (1872–1947) was an English composer and violinist. His best known work, the Elves' Dance, makes extensive use of spiccato and is a show piece for intermediate beginners of the violin."
Frantz Jehin-Prume,"Frantz Jehin-Prume (18 April 1839 – 29 May 1899) was a Canadian violinist, composer, and music educator of Belgian birth. He began his career as a highly successful concert violinist in Europe. From 1865 on he lived and worked mainly in Montreal, Canada; becoming one of the most important 19th century musical figures in Quebec. He became a naturalized Canadian citizen in 1868."
Adolf Jensen,"Adolf Jensen (12 January 1837 – 23 January 1879) was a German pianist, composer and music teacher."
Niels Peter Jensen,"Niels Peter Jensen  (23 July 1802 – 19 October 1846) was a Danish composer, flutist and organist."
Ludmila Jeske-Choińska-Mikorska,"Ludmila Jeske-Choińska-Mikorska (1849 – 2 November 1898) was a Polish singer and composer.[1] She was born in Małachowo, near Poznań, and studied singing in Vienna with Mathilde Marchesi and in Milan with Francesco Lamperti and composition in Warsaw with Gustaw Roguski and Zygmunt Noskowski.[2] Her symphonic poem Rusalka won an award in Chicago in 1893.[3] She married Teodore Jeske-Choiński and died in Warsaw.[4]"
Leon Jessel,"Leon Jessel, or Léon Jessel (22 January 1871 – 4 January 1942) was a German composer of operettas and light classical music pieces. Today he is best known internationally as the composer of the popular jaunty march The Parade of the Tin Soldiers, also known as The Parade of the Wooden Soldiers. Jessel was a prolific composer who wrote hundreds of light orchestral pieces, piano pieces, songs, waltzes, mazurkas, marches, choruses, and other salon music. He achieved considerable acclaim with a number of his operettas — in particular Schwarzwaldmädel (Black Forest Girl), which remains popular to this day."
Victorin de Joncières,"Félix-Ludger Rossignol, known as Victorin de Joncières (12 April 1839 – 26 October 1903), was a French composer and music critic.[1]"
Scott Joplin,"Scott Joplin (c. November 24, 1868 – April 1, 1917) was an American composer and pianist.[1] Because of the fame achieved for his ragtime compositions, he was dubbed the ""King of Ragtime.""[2] During his brief career, he wrote over 40 original ragtime pieces,[3] one ragtime ballet, and two operas. One of his first and most popular pieces, the ""Maple Leaf Rag"", became the genre's first and most influential hit, and has been recognized as the archetypal rag.[4] Joplin considered ragtime to be a form of classical music and largely disdained the practice of ragtime such as that in honky tonk."
José Julián Jiménez,"José Julián Jiménez (born 9 January 1823, died 1880) was a Cuban violinist and composer."
Joseph Joachim,"Joseph Joachim (28 June 1831 – 15 August 1907) was a Hungarian violinist, conductor, composer and teacher who made an international career, based in Hanover and Berlin. A close collaborator of Johannes Brahms, he is widely regarded as one of the most significant violinists of the 19th century."
T. R. G. Jozé,"Thomas Richard Gonsalvez Jozé, known as T. R. G. Jozé (26 September 1853 – 20 March 1924), was an Irish organist, teacher, choral conductor and composer who was mainly associated with the Royal Irish Academy of Music where he taught for about 45 years."
Bernard Jumentier,Bernard Jumentier (24 March 1749 – 7 December 1829) was a French composer of classical and sacred music as well as maître de chapelle.
W. H. Jude,"William Herbert Jude (1851–1922), usually credited as W.H. Jude, was an English composer and organist. Born in Westleton, Suffolk in September 1851, his parents later moved to Norfolk.[1][2] He was a precocious child, and attended Wisbech Grammar School where records note that by age eight he was composing incidental music for school plays.[3][4] He later attended Liverpool Organ School and Liverpool College of Music, also becoming college principal for a while.[5][6]"
Clotilde Kainerstorfer,Clotilde Kainerstorfer (2 July 1833 – 26 September 1897) was an Austrian composer born in Hall in Tirol. She composed sacred works and published ten pieces for piano and organ in Augsburg in 1878 as her first known compositions. She died in 1897 in Linz.[1][2][3]
Hugo Richard Jüngst,Hugo Richard Jüngst (26 February 1853 – 3 March 1923) was a German composer and choir-leader.
Friedrich Kalkbrenner,"Friedrich Wilhelm Michael Kalkbrenner (2–8 November 1785 – 10 June 1849), also known as Frédéric Kalkbrenner, was a pianist, composer, piano teacher and piano manufacturer. German by birth, Kalkbrenner studied at the Conservatoire de Paris, starting at a young age and eventually settled in Paris, where he lived until his death in 1849. Kalkbrenner composed more than 200 piano works, as well as many piano concertos and operas."
Vasily Kalinnikov,"Vasily Sergeyevich Kalinnikov (Russian: Васи́лий Серге́евич Кали́нников; 13 January 1866 [O.S. 1 January 1866] – 11 January 1901 [O.S. 29 December 1900]) was a Russian composer. His body of work consists of two symphonies, several additional orchestral works, and numerous songs, all of them imbued with characteristics of folksong. His symphonies, particularly the First, were frequently performed in the early 20th century."
Jan Kalivoda,"Jan Křtitel Václav Kalivodus (Johann Baptist Wenzel Kalliwoda in German) (February 21, 1801 – December 3, 1866) was a composer, conductor and violinist of Bohemian birth."
Heinrich Ernst Kayser,"Heinrich Ernst Kayser (16 April 1815 in Altona, Hamburg – 17 January 1888 in Hamburg) was a German violinist, violist, pedagogue and composer."
Mieczysław Karłowicz,"Mieczysław Karłowicz ([miɛt͡ʂɨswaf ˈkarwɔvit͡ʂ], 11 December 1876 – 8 February 1909) was a Polish composer and conductor."
Alexander Kastalsky,Alexand(e)r Dmitriyevich Kastalsky (Russian: Александр Дмитриевич Кастальский) (28 November [O.S. 16 November] 1856 – 17 December 1926) was a Russian composer and folklorist.
Alfredo Keil,Alfredo Cristiano Keil (3 July 1850 – 4 October 1907) was a Portuguese romantic composer and painter.
Christoffer Christian Karsten,Christoffer Christian (or Kristofer Kristian) Karsten (9 September 1756 – 6 August 1827) was a Swedish opera singer.  He was the maternal grandfather of the ballerina Marie Taglioni.
Daniil Kashin,"Daniil Nikititsch Kaschin (1769 – December 1841) was a Russian composer, pianist, conductor, and folk-song collector.[citation needed]"
William Henry Kearns,"William Henry Kearns (1794 – 28 December 1846) was an Irish violinist, conductor and composer active mainly in England."
Lothar Kempter,Lothar Kempter (5 February 1844 – 14 July 1918) was a German-Swiss composer and conductor.[1]
Eugène Ketterer,Eugène Ketterer (7 July 1831 – 18 December 1870) was a prolific French composer and pianist who was known for his numerous salon arrangements of contemporary opera arias.
Friedrich Kiel,Friedrich Kiel (8 October 1821 – 13 September 1885) was a German composer and music teacher.
Theodor Kirchner,Fürchtegott Theodor Kirchner (10 December 1823 – 18 September 1903) was a German composer and pianist of the Romantic era.
Halfdan Kjerulf,Halfdan Kjerulf (17 September 1815 – 11 August 1868) was a Norwegian composer.[1]
Bernhard Klein,Bernhard Joseph Klein (6 March 1793 – 9 September 1832)[1] was a German composer.
Julian Klemczyński,Julian Klemczyński was a Polish composer and teacher who spent the bulk of his career in France.
Albert Ketèlbey,"Albert William Ketèlbey (/kəˈtɛlbi/; born Ketelbey; 9 August 1875 – 26 November 1959) was an English composer, conductor and pianist, best known for his short pieces of light orchestral music. He was born in Birmingham and moved to London in 1889 to study at Trinity College of Music. After a brilliant studentship he did not pursue the classical career predicted for him, becoming musical director of the Vaudeville Theatre before gaining fame as a composer of light music and as a conductor of his own works."
Johann Baptist Klerr,Johann Baptist Klerr (15 July 1830 – 27 September 1875) was an Austrian Kapellmeister and composer.[1]
Philip Knapton,"Philip Knapton (20 October 1788 – 20 June 1833) was an English organist and composer, active in the musical life of York."
Iwan Knorr,Iwan Otto Armand Knorr (3 January 1853 – 22 January 1916) was a German composer and music teacher.
Nobu Kōda,"Nobu Kōda 幸田延 (1870–1946) was a Japanese composer, violinist, and music teacher. She was one of the first Japanese women to study music overseas.[1] She studied at the New England Conservatory. She later studied in Europe.[2] She was the sister of Kōda Rohan."
Karl Klindworth,"Karl Klindworth (25 September 1830 – 27 July 1916) was a German composer, virtuoso pianist, conductor, violinist and music publisher. He was one of Franz Liszt's pupils and later one of his closest disciples and friends, being also on friendly terms with composer Richard Wagner, of whom he was an admirer.  He was highly praised by fellow musicians, including Wagner himself and Edward Dannreuther. Among his pupils were Hans von Bülow, Georgy Catoire, and Ethelbert Nevin."
Hyacinthe Klosé,"Hyacinthe Eléonore Klosé (11 October 1808 – 29 August 1880) was a French clarinet player, professor at the Conservatoire de Paris, and composer."
František Kmoch,František Kmoch (1 August 1848 – 30 April 1912) was a Czech composer and conductor.
Hans von Koessler,"Hans von Koessler (1 January 1853 – 23 May 1926) was a German composer, conductor and music teacher. In Hungary, where he worked for 26 years, he was known as János Koessler."
Charles Koechlin,"Charles-Louis-Eugène Koechlin (French: [ʃaʁl lwi øʒɛn keklɛ̃]; 27 November 1867 – 31 December 1950), commonly known as Charles Koechlin, was a French composer, teacher and musicologist. He was a political radical all his life and a passionate enthusiast for such diverse things as medieval music, The Jungle Book of Rudyard Kipling, Johann Sebastian Bach, film stars (especially Lilian Harvey and Ginger Rogers), traveling, stereoscopic photography and socialism. He once said: ""The artist needs an ivory tower, not as an escape from the world, but as a place where he can view the world and be himself. This tower is for the artist like a lighthouse shining out across the world.""[1] Among his better known works is Les Heures persanes, a set of piano pieces based on the novel Vers Ispahan by Pierre Loti."
Karel Komzák II,Karel Komzák II (8 November 1850 – 23 April 1905) was a Bohemian-born Viennese composer famous for his dances and marches. He composed the Erzherzog-Albrecht-Marsch.
Louis Köhler,"Christian Louis Heinrich Köhler (5 September 1820 – 16 February 1886) was a German composer, conductor and piano teacher."
Ernesto Köhler,Ernesto Köhler (4 December 1849 – 17 March 1907) was an Italian flautist and composer. He was considered one of the best flautists of his era.[1]
Anton de Kontski,"Anton de Kontski (25 September 1816 – 7 December 1899) was a Polish pianist and composer.  He was also known as Antoni Kątski and Antoine de Kontski, sometimes with the appellation ""Chevalier."""
Alexander Kopylov,"Alexander Alexandrovich Kopylov or Kopilov[1] (Александр Александрович Копылов, 14 July 1854 – 20 February 1911) was an Imperial Russian composer and violinist."
Arseny Koreshchenko,"Arseny Nikolayevich Koreshchenko (Russian: Арсений Николаевич Корещенко, 18 December 1870 – 6 January 1921) was a Russian pianist and composer of classical music, including operas and ballets."
Karel Kovařovic,"Karel Kovařovic (Prague, 9 December 1862  –  Prague, 6 December 1920) was a Czech composer and conductor."
Clara Anna Korn,"Clara Anna Korn (1866–1941) was an American pianist, composer and music writer. She was born in Germany, but her family moved to the United States and she grew up in New Jersey. She studied at the National Conservatory of Music in New York City with B.O. Klein, Antonín Dvořák and Horatio Parker.[1][2]"
Alexander Koshetz,"Alexander Koshetz (12 September 1875 – 21 September 1944) was a Ukrainian choral conductor, arranger, composer, ethnographer, writer, musicologist, and lecturer.  He helped popularize Ukrainian music around the world. His name is sometimes transliterated as Oleksandr Koshyts (Ukrainian: Олександр Кошиць)."
Heinrich Köselitz,"Johann Heinrich Köselitz (10 January 1854 – 15 August 1918) was a German author and composer. He is known for his longtime friendship with Friedrich Nietzsche, who gave him the pseudonym Peter Gast."
Sakunosuke Koyama,Sakunosuke Koyama (19 January 1864 – 27 June 1927) was a Japanese composer and music teacher. He was the founder and president of the Japanese Music Education Federation.
Leopold Koželuch,"Leopold Koželuch (Czech pronunciation: [ˈlɛopolt ˈkoʒɛlux], born Jan Antonín Koželuh, alternatively also Leopold Koželuh, Leopold Kotzeluch) (26 June 1747 – 7 May 1818) was a Czech composer and music teacher."
Antonín Kraft,"Antonín Kraft (30 December 1749,[1] Rokycany – 28 August 1820,[2] Vienna) was a Czech cellist and composer. He was a close friend of Haydn, Mozart, and Beethoven."
Johann Baptist Krall,"Johann Baptist Krall (1803–4 May 1883) was an Austrian composer, conductor, music editor/arranger, and member of the board of directors of the Wiener Singverein of the Gesellschaft der Musikfreunde."
Karl August Krebs,"Karl August Krebs (16 January 1804 as Karl August Miedke – 16 May 1880), also Carl, Miedtke,[1] was a German pianist, composer, conductor and Kapellmeister."
Stephan Krehl,"Stephan Krehl (5 July 1864 – 9 April 1924, in Leipzig[1]) was a German composer, teacher, and theoretician.  His writings include Traité général de la musique and Théorie de la musique et de science de la composition. His pupils included Else Streit and the Spanish composer Pablo Sorozábal."
Fritz Kreisler,"Friedrich ""Fritz"" Kreisler (February 2, 1875 – January 29, 1962) was an Austrian-born American violinist and composer.[1] One of the most noted violin masters of his day, and regarded as one of the greatest violinists of all time, he was known for his sweet tone and expressive phrasing. Like many great violinists of his generation, he produced a characteristic sound which was immediately recognizable as his own. Although it derived in many respects from the Franco-Belgian school, his style is nonetheless reminiscent of the gemütlich (cozy) lifestyle of pre-war Vienna."
Franz Krenn,"Franz Krenn (26 February 1816 – 18 June 1897) was an Austrian composer and composition teacher born in Droß. He studied under Ignaz von Seyfried in Vienna,[1] and served as organist in a number of Viennese churches, becoming Kapellmeister of St. Michael's Church in Vienna in 1862.[1] From 1869 until 1893 Krenn taught harmony, counterpoint and composition at the Vienna Conservatory. During this time, he appears to have acquired the nickname 'Old Krenn', and is today often described as having been a rather pedantic teacher.[2]"
Conradin Kreutzer,"Conradin Kreutzer or Kreuzer (22 November 1780 – 14 December 1849) was a German composer and conductor. His works include the operas Das Nachtlager in Granada and incidental music to Der Verschwender, both produced in 1834 in Vienna."
Halina Krzyżanowska,"Halina Krzyżanowska (1860, Paris–1937, Rennes) was an internationally renowned Polish-French pianist and composer."
Emil Kreuz,"Emil Anton Joseph Friedrich Kreuz, also known as Emil Frederick Thornfield (25 May 1867 – 3 December 1932) was a German violinist, violist, teacher, conductor and composer."
Jaroslav Křička,"Jaroslav Křička (Czech: [ˈjaroslaf ˈkr̝̊ɪt͡ʃka]; 27 August 1882 in Kelč, Moravia – 23 January 1969 in Prague) was a Czech composer, conductor, and music teacher. He was the brother of poet Petr Křička[de]."
Pavel Křížkovský,"Pavel Křížkovský (born as Karel Křížkovský) (9 January 1820, Kreuzendorf – 8 May 1885, Brno) was a Czech choral composer and conductor."
Jan Kubelík,Jan Kubelík (5 July 1880 – 5 December 1940) was a Czech violinist and composer.
Franz Krommer,Franz Krommer (Czech: František Vincenc Kramář; 27 November 1759 in Kamenice u Jihlavy – 8 January 1831 in Vienna) was a Czech composer of classical music and violinist. His 71-year lifespan began half a year after the death of George Frideric Handel and ended nearly four years after that of Ludwig van Beethoven.
Anne-Marie Krumpholtz,Anne-Marie Krumpholtz (née Steckler) was a French harpist and composer.
Rodolphe Kreutzer,"Rodolphe Kreutzer (15 November 1766[1] – 6 January 1831) was a French violinist, teacher, conductor, and composer of forty French operas, including La mort d'Abel (1810)."
Friedrich Wilhelm Kücken,"Friedrich Wilhelm Kücken (16 November 1810 – 3 April 1882) was a German composer and conductor. He was a very prolific composer, mainly known for light and melodious songs, although he has also written works for the stage and for orchestra."
Pavel Kuczynski,Pavel Kuczynski (1846–1897) was a Polish composer.
Vincas Kudirka,"Vincas Kudirka (31 December [O.S. 19 December] 1858 – 16 November [O.S. 4 November] 1899) was a Lithuanian poet and physician, and the author of both the music and lyrics of the Lithuanian National Anthem, Tautiška giesmė. He is regarded in Lithuania as a National Hero. Kudirka used pen names V. Kapsas, Paežerių Vincas, Vincas Kapsas, P.Vincas, Varpas, Q.D, K., V.K, Perkūnas."
Johann Hermann Kufferath,Johann Hermann Kufferath (12 May 1797 – 28 July 1864) was a German composer.
Wilhelm Kuhe,"Wilhelm Kuhe (10 December 1823 – 8 October 1912) was a German pianist and piano teacher, composer and administrator born in the city of Prague (modern-day Czech Republic), in the first half of the nineteenth century."
Friedrich Kuhlau,"Friedrich Daniel Rudolf Kuhlau (German; Danish sometimes Frederick Kulav) (11 September 1786 – 12 March 1832) was a Danish pianist and composer during the late Classical and early Romantic periods. He was a central figure of the Danish Golden Age and is immortalized in Danish cultural history through his music for Elves' Hill, the first true work of Danish National Romanticism and a concealed tribute to the absolute monarchy. To this day it is his version of this melody which is the definitive arrangement."
Jan Křtitel Kuchař,"Jan Křtitel Kuchař, or also German: Johann Baptist Kucharz (5 March 1751 in Choteč – 18 February 1829 in Prague) was a Czech organist, mandolinist, harpsichordist, music composer, operatic conductor, and teacher.[1]"
Izabella Kuliffay,"Izabella Kuliffay (29 December 1863 – 19 January 1945) was a Hungarian pianist and composer. She was born in Pest, and studied music at the National Conservatory in Budapest from 1877–79, and the Budapest Academy of Music from 1879–83, with teachers including Kornel Abranyi and Gyula Erkel.[1] Her work was also heavily influenced by Franz Liszt.[2]"
Théodore Labarre,Théodore François Joseph Berry Labarre (23 March 1805 – 9 March 1870) was a French harpist and composer. He lived in Paris and in London and was awarded the Prix de Rome in 1823 as well as the Légion d'honneur in 1862.
Jean-Baptiste Labelle,"Jean-Baptiste Labelle (September 1825 – 9 September 1898) was a Canadian composer, organist, pianist, and conductor. He is best known for composing the music to the song Ô Canada! mon pays, mes amours (words 1834, music before 1868) with words by George-Étienne Cartier. He also used words by Cartier for the song Avant tout je suis Canadien (1860). Some of his other notable works include the cantatas Cantate: La Confédération (1868) and La Croisade canadienne (1886); the operetta La Conversion d'un pêcheur de la Nouvelle-Écosse (published by the A.J. Boucher Co. in 1868); the piano pieces Marche canadienne (1846) and Quadrille national canadien; and the song Chant des Zouaves canadiens (1881).[1]"
Theodor Kullak,"Theodor Kullak (12 September 1818 – 1 March 1882) was a German pianist, composer, and teacher."
Aleksander Kunileid,"Aleksander Kunileid (born Aleksander Saebelmann; 22 November 1845 – 27 July 1875), was an Estonian composer. He is one of the founding figures of Estonian choral music."
Karol Kurpiński,"Karol Kazimierz Kurpiński (March 6, 1785 – September 18, 1857) was a Polish composer, conductor and pedagogue. He was a representative of late classicism and a member of the Warsaw Society of Friends of Learning (Polish: Towarzystwo Warszawskie Przyjaciół Nauk, TWPN). He is also known for having composed the music to the 1831 patriotic song La Varsovienne with lyrics by Casimir Delavigne. He was also a mentor and influence  of a young Chopin."
Elisabeth Kuyper,Elisabeth Johanna Lamina Kuyper (13 September 1877 – 26 February 1953) was a Dutch Romantic composer and conductor.
Adrien de La Fage,Juste-Adrien-Lenoir de La Fage (28 March 1801 – 8 March 1862) was a French composer and musicologist.
Louise Geneviève de La Hye,"Louise Geneviève de La Hye née Rousseau (8 March 1810 - 17 November 1838) was a French pianist, organist and composer, who sometimes used the pseudonym M. Leon Saint-Amons."
Théodore Lack,Théodore Lack (3 September 1846 – 25 November 1921) was a French pianist and composer.
Joseph Labitzky,"Joseph Labitzky (Czech: Josef Labický; 4 July 1802 in Krásno – 18 August 1881 in Karlovy Vary) was a Bohemian composer, violinist, and conductor. He studied with Karl Veit in his youth.[1] Labitzky joined a traveling orchestra at age 14, and in 1820 took a position in an orchestra in Marienbad. In 1823-24 he was in Munich, and following this he toured Germany as a concert violinist. He put together his own orchestra in 1825, touring Vienna and Warsaw. He took a conducting position in Karlsbad in 1835, and his dance pieces became quite popular throughout Europe, including England. He was involved in ""Cocks vs Purday"", a British court case concerning copyright.[2] He was the father of August Labitzky. Labitzky composed 300 dance pieces."
Josef Labor,"Josef Paul Labor (29 June 1842 – 26 April 1924) was an Austrian pianist, organist, and composer of the late Romantic era. Labor was an influential music teacher. As a friend of some key figures in Vienna, his importance was enhanced."
Vinzenz Lachner,Vinzenz Lachner (also spelled Vincenz) (19 July 1811 – 22 January 1893)[1] was a German composer and conductor.
