title,paragraph
Elizabeth Philp,"Elizabeth Philp (1827 – 26 November 1885) was an English singer, music educator and composer."
Maria Antonietta Picconi,"Maria Antonietta Picconi (born 23 September 1869, d. 1926) was an Italian composer and pianist born in Rome, Italy. She studied piano at the St. Cecilia Conservatory in Rome with Giovanni Sgambati and composition with Eugenio Terziani. She performed as a concert pianist from 1886 to 1896, and then worked as a piano and voice teacher. She died in Rome in 1926.[1][2]"
Gabriel Pierné,"Henri Constant Gabriel Pierné (16 August 1863 – 17 July 1937) was a French composer, conductor, pianist and organist."
Albert Pieczonka,"Albert Emil Theodor Pieczonka (February 10, 1828 - April 12, 1912) was a composer, pianist and music instructor who resided in Germany, England, and the United States. His most famous work, the ""Tarantella in A Minor"", remains a popular piano standard more than 100 years after his death."
Johann Gottfried Piefke,"Johann Gottfried Piefke (9 September 1817 – 25 January 1884) was a German band leader, (Kapellmeister) and composer of military music."
Henry Hugh Pierson,"Henry Hugh Pierson (12 April 1815 – 28 January 1873) was an English composer resident from 1845 in Germany.  He was born Henry Hugh Pearson and his middle name is sometimes given as Hugo.[1] His original name was Henry Hugh Pearson, in Germany he used  Heinrich Hugo Pierson.[2] He had success in his adopted country with his operas and songs but little in his own, and his music is now rarely performed."
Auguste Pilati,"Auguste Pilati (actual name ""Auguste Pilate"") (29 September 1810 – 1 August 1877) was a prolific French composer, opera conductor and occasional singer. He employed several pseudonyms including ""Auguste Pilati Juliano"", ""A. P. Juliano"", ""Ate. P. Juliano"", ""A. Ruytler"", ""P. Ruytler"", and ""Wolfart"". He wrote about 40 works for the stage,[1] including operas, operettas, and ballets besides a very large number of popular songs and piano works.[2]"
Jean Pietrapertosa,"Jean Pietrapertosa (1855–1940) was a composer and virtuoso of the mandolin who performed in Paris in the 1880s. He taught the mandolin and wrote a two-volume mandolin method book, Méthode de mandolin, published in Paris in 1892. He also organized a mandolin orchestra.[1]"
Jules Pillevestre,Jules François Firmin Pillevestre (real name: Pillevesse) (11 November 1837 – 27 June 1903) was a 19th-century French composer and conductor.
Ciro Pinsuti,"Ciro Pinsuti (9 May 1829 – 10 March 1888) was an Anglo-Italian composer. Educated in music for a career as a pianist, he studied composition under Rossini. From 1848 he made his home in England, where he became a teacher of singing, and in 1856 he was made a professor at the Academy of Music in London.[1]"
Josef Pischna,Josef Pischna (Czech: Josef Pišna; 15 June 1826 – 19 October 1896) was a Czech pianist and composer.
Fanny Krumpholtz Pittar,"Louisa Françoise ""Fanny"" Therese Pittar (nee Krumpholtz) (born 1781 Paris – died 1862[1] Brighton) was a Bohemian harpist and composer. She was the daughter of composer Johann Baptist Krumpholtz (1742–1790) and his wife Anne-Marie Krumpholtz."
Johann Peter Pixis,"Johann Peter Pixis (10 February 1788 – 22 December 1874) was a German pianist and composer, born in Mannheim. He lived in Vienna from 1808 to 1824, then in Paris to 1840, during which time he was among the city's most prominent pianists and composers, although he is almost entirely forgotten nowadays."
Charles-François Plantade,Charles-François Plantade (14 April 1787 – 26 May 1870) was a 19th-century French composer.
Ildebrando Pizzetti,"Ildebrando Pizzetti (20 September 1880 – 13 February 1968) was an Italian composer of classical music, musicologist, and music critic."
Ferdinand Poise,"Jean Alexandre Ferdinand Poise (3 June 1828 – 13 May 1892) was a French composer, mainly of opéra-comiques, for which he also frequently wrote the librettos."
Charles Poisot,"Charles Poisot (7 July 1822 – 4 March 1904) was a French musician from the second half of the 19th century. A pianist, composer and musicographer, he was also director of the Dijon Conservatory, where he spent his life."
Richard Pohl,"Richard Pohl (September 12, 1826 – December 17, 1896) was a German music critic, writer, poet, and amateur composer.  He figured prominently in the mid-century War of the Romantics, taking the side opposite Eduard Hanslick, and championing the ""Music of the Future"" (the progressive Romantic style of Franz Liszt and Richard Wagner)."
Ignaz Pleyel,"Ignace Joseph Pleyel (French: [plɛjɛl]; German: [ˈplaɪl̩]; 18 June 1757 – 14 November 1831) was an Austrian-born French composer, music publisher[1] and piano builder of the Classical period.[2]"
Amilcare Ponchielli,"Amilcare Ponchielli (US: /ˌpɒŋkiˈɛli, ˌpɔːŋ-/,[1][2] Italian: [aˈmilkare poŋˈkjɛlli]; 31 August 1834 – 16 January 1886) was an Italian opera composer, best known for his opera La Gioconda. He was married to the soprano Teresina Brambilla."
Pierre Jean Porro,"Pierre-Jean Porro (7 December 1750 – 31 May 1831) was an influential French classical guitarist, composer and music publisher.[1]"
Józef Michał Poniatowski,"Józef Michał Poniatowski (Rome, 24 July 1814 – London, 4 July 1873) was a Polish szlachcic, a composer and an operatic tenor. He was the nephew of the Polish general  Prince Józef Antoni Poniatowski.[1][2] He was created the 1st Conte di Monte Rotondo on 20 November 1847, and the first Principe di Monte Rotondo on 19 November 1850[3][better source needed] by Grand Duke of Tuscany Leopold II.[4]"
David Popper,"David Popper (June 16, 1843 – August 7, 1913) was a Bohemian cellist and composer.[1]"
Ciprian Porumbescu,"Ciprian Porumbescu (Romanian: [tʃipriˈan porumˈbesku]; born Cyprian Gołęmbiowski on 14 October 1853 – 6 June 1883) was a Romanian composer born in Șipotele Sucevei in Bukovina (now Shepit, Vyzhnytsia Raion, Ukraine). He was among the most celebrated Romanian composers of his time; his popular works include Crai nou, Song of the Tricolour, Song for Spring, Ballad for violin and piano, and Serenada. In addition, he composed the music for the Romanian patriotic ""Song of Unity"", also known as ""Pe-al nostru steag e scris Unire"" (""Unity is Written on our Flag""), which was Romania's anthem from 1975 to 1977 and is currently used for Albania's national anthem, ""Himni i Flamurit"". His work spreads over various forms and musical genres, but the majority of his work is choral and operetta."
Edward Potjes,Edward Potjes (born Eduard Adriaan Nicolaas; in French Edouard-Adrien-Nicolas) was a Dutch composer and piano virtuoso.
William H. Potstock,"William Herman Potstock (Wilhelm Hermann), (1872–1941) was a German American musician and composer. His best known work “Souvenir De Sarasate ” combines different techniques (left-hand pizzicato and double stops) and is a popular virtuoso piece."
Cipriani Potter,"Philip Cipriani Hambly Potter (3 October 1792 – 26 September 1871) was an English musician. He was a composer, pianist, conductor and teacher. After an early career as a performer and composer, he was a teacher in the Royal Academy of Music in London and was its principal from 1832 to 1859."
Louis-Barthélémy Pradher,"Louis-Barthélémy Pradher (16 December 1782 – 19 October 1843) was a French composer, pianist and music educator."
Ferdinand Praeger,"Ferdinand Praeger (22 January 1815 – 2 September 1891) (aka Ferdinand Christian Wilhelm Praeger) was a composer, music teacher, pianist and writer. He is now best known for his controversial biography of Richard Wagner, Wagner As I Knew Him, published in 1892 after Praeger's death."
Silas G. Pratt,"Silas Gamaliel Pratt (August 4, 1846 – October 30, 1916) was an American composer.  A native of Addison, Vermont, he worked in Chicago, New York, and Pittsburgh, in addition to studies and travels in Germany.  Between 1868 and 1871, he studied under Theodor Kullak, among others, but he suffered a wrist injury during a lesson, which prevented his becoming a professional concert pianist.  On a later trip to Germany, following a performance of Pratt's works, Franz Liszt gave him encouragement and advice."
Oliveria Prescott,Oliveria Louisa Prescott (3 September 1842 – 9 September 1919) was an English writer and composer.[1]
Eugène Prévost (musician),Eugène-Prosper Prévost (23 April 1809 – 19 August 1872) was a French composer and conductor.
Heinrich Proch,Heinrich Proch (22 July 1809 – 18 December 1878) was an Austrian composer.
Josef Proksch,"Josef Proksch or Joseph Proksch (4 August 1794, Reichenberg (now Liberec) – 20 December 1864, Prague) was a Bohemian-German pianist and composer. His daughter, Marie Proksch, was also a well-known pianist and composer."
Marie Proksch,"Marie Proksch (1836 – 17 May 1900) was a Bohemian pianist, music educator and composer."
François Prume,"François Hubert Prume (3 June 1816, Stavelot – 14 July 1849, Liège) was a Belgian violinist and composer."
Émile Prudent,"Émile Racine Gauthier Prudent (3 February 1817 – 14 May 1863) was a French pianist and composer. His works number about seventy, and include a piano trio, a concerto-symphony, many character pieces, sets of variations, transcriptions and etudes, in addition to his celebrated fantasies on operatic airs. As a teacher, he was very successful and produced several distinguished pupils."
Loïsa Puget,Loïsa Puget (11 February 1810 – 24 October 1889) was a French composer.
Ferdinando Provesi,"Ferdinando Angelo Maria Provesi (1770 – 1833) was a native of Parma, Italy. He was regarded as one of the greatest Italian opera composers of the era[by whom?]. Provesi is best known as being an early tutor of Giuseppe Verdi when he was the Maestro di cappella (master of music) at the St. Bartolomeo cathedral in Busseto (the town very close to Le Roncole, the village where Verdi was born.) Provesi was also director of the municipal music school and local Philharmonic Society. He began teaching Verdi in 1824 when the future composer was 11 years old."
Domenico Puccini,"Domenico Vincenzo Maria Puccini (5 April 1772 – 25 May 1815) was an Italian composer, a contemporary of Muzio Clementi,  Johann Nepomuk Hummel, Franz Schubert and Ludwig van Beethoven."
Giuseppe Puzone,"Giuseppe Puzone (12 February 1820 – 17 October 1914) was an Italian opera composer and conductor active in Naples, the city of his birth. He was for many years the principal conductor of the Teatro San Carlo where his opera Elfrida di Salerno had premiered in 1849. He composed three other operas, all of which premiered in Naples, as well as sacred and symphonic music.[1][2]"
Cesare Pugni,"Cesare Pugni (Italian pronunciation: [ˈtʃeːzare ˈpuɲɲi, ˈtʃɛː-]; Russian: Цезарь Пуни, romanized: Cezar' Puni; 31 May 1802 in Genoa – 26 January [O.S. 14 January] 1870) was an Italian composer of ballet music, a pianist and a violinist. In his early career he composed operas, symphonies, and various other forms of orchestral music. Pugni is most noted for the ballets he composed for Her Majesty's Theatre in London (1843–1850), and for the Imperial Theatres in St. Petersburg, Russia (1850–1870). The majority of his ballet music was composed for the works of the ballet master Jules Perrot, who mounted nearly every one of his ballets to scores by Pugni. In 1850 Perrot departed London for Russia, having accepted the position of Premier maître de ballet of the St. Petersburg Imperial Theatres at the behest of Carlotta Grisi, who was engaged as Prima ballerina. Cesare Pugni followed Perrot and Grisi to Russia, and remained in the imperial capital even after Grisi's departure in 1853 and Perrot's departure in 1858. Pugni went on to compose for Perrot's successors Arthur Saint-Léon and Marius Petipa, serving as the Imperial Theatre's official composer of ballet music until his death in 1870. He was also the grandfather of Russian painter Ivan Puni, also known as Iwan Puni and Jean Pougny."
Raoul Pugno,"Stéphane Raoul Pugno (23 June 1852 – 3 January 1914 [O.S. 21 December 1913]) was a French composer, teacher, organist, and pianist known for his playing of Mozart's works."
Giacomo Puccini,"Giacomo Puccini[n 1] (22 December 1858 –  29 November 1924) was an Italian composer known primarily for his operas. Regarded as the greatest[1] and most successful proponent of Italian opera after Verdi, he was descended from a long line of composers, stemming from the late-Baroque era. Though his early work was firmly rooted in traditional late-19th-century Romantic Italian opera he later developed his work in the realistic verismo style, of which he became one of the leading exponents."
Francesc Queralt,"Francesc (sometimes Francisco) Queralt (1740 - 28 February 1825) was a Spanish composer, long active in Barcelona."
Joseph Quesnel,"Joseph Quesnel (15 November 1746 – 2 or 3 July 1809) was a French Canadian composer, poet, playwright and slave-trader.  Among his works were two operas, Colas et Colinette and Lucas et Cécile; the former is considered to be the first Canadian opera and probably of North America.[1][2][3]"
Alfred Quidant,"Pierre Robert Joseph (Alfred) Quidant (7 December 1815 – 9 October 1893) was a French pianist, composer and music teacher."
Guglielmo Quarenghi,"Guglielmo Quarenghi (October 22, 1826, Casalmaggiore, Italy – February 3, 1882) was an Italian composer and cellist. From 1839 to 1842 he studied with Vincenzo Merighi at the Milan Conservatory. In 1850, he became principal cellist at La Scala, and in 1851 a professor at the conservatory.[1] Along with Luigi Felice Rossi and Alberto Mazzucato, Quarenghi formed the Società di S Cecilia in 1860. In 1879, he succeeded Raimondo Boucheron as maestro di cappella of Milan Cathedral. He resigned two years later due to ill-health and died in 1882.[1]"
Carles Quilmetas,"Carles Quilmetas (1775-1834) was a Spanish composer, violinist, and double-bassist long active in Girona."
Giovanni Quirici,Giovanni Quirici (1824–1896) was an Italian composer.
Pietro Raimondi,"Pietro Raimondi (December 20, 1786, Rome – October 30, 1853) was an Italian composer, transitional between the Classical and Romantic eras. While he was famous at the time as a composer of operas and sacred music, he was also as an innovator in contrapuntal technique as well as in creation of gigantic musical simultaneities."
Rudolf Raimann,"Rudolf Raimann (7 May 1861, Veszprém, Hungary – 26 September 1913, Vienna, Austria) was a Hungarian composer. For many years he worked as the chief composer and music director to Prince Esterházy. He composed 15 operas and operettas for the court, of which Enoch Arden is considered his best work. He also wrote numerous art songs and songs for the piano-forte."
Wilhelm Ramsøe,"Wilhelm  Ramsøe (7 February 1837 – 15 April 1895) was a Danish composer, musician and conductor. [1]"
Émile Pierre Ratez,"Émile Pierre Ratez (also René Emile Ratez; 5 November  1851– 19 May 1934) was a French composer, administrator, and violist."
Antoni Radziwiłł,"Prince Antoni Henryk Radziwiłł (Polish pronunciation: [anˈtɔɲi ˈxɛnrɨk raˈd͡ʑiviww]; 13 June 1775 – 7 April 1833) was a Polish and Prussian noble, aristocrat, musician, and politician. Initially an hereditary Duke of Nieśwież and Ołyka, as a scion of the Radziwiłł family he also held the honorific title of a Reichsfürst of the Holy Roman Empire. Between 1815 and 1831 he acted as Duke-Governor (Polish: książę-namiestnik, German: Statthalter) of the Grand Duchy of Posen, an autonomous province of the Kingdom of Prussia created out of Greater Polish lands annexed in the Partitions of Poland."
Joachim Raff,"Joseph Joachim Raff (27 May 1822 – 24 or 25 June 1882) was a German-Swiss composer, pedagogue and pianist."
List of Romantic composers,"The Romantic era of Western Classical music spanned the 19th century to the early 20th century, encompassing a variety of musical styles and techniques. Part of the broader Romanticism movement of Europe, Ludwig van Beethoven  and Franz Schubert are often seen as the dominant transitional figures composers from the preceding Classical era. Many composers began to channel nationalistic themes, such as Mikhail Glinka, The Five and Belyayev circle in Russia; Frédéric Chopin in Poland; Carl Maria von Weber in Germany; Edvard Grieg in Norway; Jean Sibelius in Finland; Giuseppe Verdi in Italy; Carl Nielsen in Denmark; Isaac Albéniz in Spain; Ralph Vaughan Williams and Edward Elgar in England; Mykola Lysenko in Ukraine; and Bedřich Smetana and Antonín Dvořák in what is now the Czech Republic."
Sergei Rachmaninoff,"Sergei Vasilyevich Rachmaninoff[a][b] (1 April [O.S. 20 March] 1873 – 28 March 1943) was a Russian composer, virtuoso pianist, and conductor. Rachmaninoff is widely considered one of the finest pianists of his day and, as a composer, one of the last great representatives of Romanticism in Russian classical music. Early influences of Tchaikovsky, Rimsky-Korsakov, and other Russian composers gave way to a thoroughly personal idiom notable for its song-like melodicism, expressiveness and rich orchestral colours.[4] The piano is featured prominently in Rachmaninoff's compositional output and he made a point of using his skills as a performer to fully explore the expressive and technical possibilities of the instrument."
Oreste Ravanello,Oreste Ravanello (25 August 1871 in Venice – 2 July 1938 in Padua) was an Italian composer and organist.
Vladimir Rebikov,"Vladimir Ivanovich Rebikov (Russian: Влади́мир Ива́нович Ре́биков, Vladi'mir Iva'novič Re'bikov; May 31 [OS May 19] 1866 –  August 4, 1920) was a late romantic 20th-century Russian composer and pianist."
Emma Marcy Raymond,"Emma Marcy Raymond (pseudonym, Salvator Sylvain; 1839–1913) was an American musician, composer, and author of operetta, songs and piano music. She was one of very few women in her day who had composed the entire music of an opera and lived to see it produced.[1]"
Thomas German Reed,"Thomas German Reed (27 June 1817 – 21 March 1888), known after 1844 as simply German Reed was an English composer, musical director, actor, singer and theatrical manager of the Victorian era.  He was best known for creating the German Reed Entertainments, together with his actress wife, a genre of musical plays that made theatre-going respectable at a time when the stage was considered disreputable."
Napoléon Henri Reber,Napoléon Henri Reber (21 October 1807 – 24 November 1880) was a French composer.
Amalia Redec,"Amalia Redec (4 May 1812 – 21 November 1885), was a Swedish pianist and composer.[1]  She was a concert pianist and a piano teacher and she produced compositions for piano music in the style of the Romanticism of the 1850s."
Max Reger,"Johann Baptist Joseph Maximilian Reger (19 March 1873 – 11 May 1916), commonly known as Max Reger, was a German composer, pianist, organist, conductor, and academic teacher. He worked as a concert pianist, as a musical director at the Leipzig University Church, as a professor at the Royal Conservatory in Leipzig, and as a music director at the court of Duke Georg II of Saxe-Meiningen."
Maurice Ravel,"Joseph Maurice Ravel[n 1] (7 March 1875 – 28 December 1937) was a French composer, pianist and conductor. He is often associated with Impressionism along with his elder contemporary Claude Debussy, although both composers rejected the term. In the 1920s and 1930s Ravel was internationally regarded as France's greatest living composer."
Gustav Reichardt,"Gustav Reichardt, also Heinrich Wilhelm Ludwig Gustav Reichardt (13 November 1797 – 18 October 1884), was a 19th-century German music teacher and composer."
Giulio Regondi,"Giulio Regondi (1822 – 6 May 1872) was a Swiss-born classical guitarist, concertinist and composer active in France and (mainly) the United Kingdom."
Louise Reichardt,"Louise Reichardt or Luise Reichardt (11 April 1779 – 17 November 1826) was a German composer and choral conductor. Her German songs or Lieder, written in an accessible style akin to folk music, were popular, and she was influential in the musical life of Hamburg, Germany, where she lived from 1809.[1][2]"
Caroline Reinagle,"Caroline Reinagle (born Caroline Orger) (1 May 1817 – 11 March 1892) was an English classical composer, pianist, and writer. Only a few of her works have survived."
Anton Reicha,"Anton (Antonín, Antoine) Joseph Reicha (Rejcha) (26 February 1770 – 28 May 1836) was a Czech-born, Bavarian-educated, later naturalized French composer and music theorist.[1] A contemporary and lifelong friend of Beethoven, he is now best remembered for his substantial early contributions to the wind quintet literature and his role as teacher of pupils including Franz Liszt, Hector Berlioz and César Franck. He was also an accomplished theorist, and wrote several treatises on various aspects of composition. Some of his theoretical work dealt with experimental methods of composition, which he applied in a variety of works such as fugues and études for piano and string quartet."
Carl Reinecke,"Carl Heinrich Carsten Reinecke (23 June 1824 – 10 March 1910) was a German composer, conductor, and pianist in the mid-Romantic Era."
Heinrich Reimann,"Professor Dr. phil. Heinrich Reimann (March 12, 1850 – May 24, 1906), was a German musicologist, organist, and composer."
Hugo Reichenberger,Hugo Reichenberger (28 July 1873 – 11 October 1938) was a German conductor and composer.
Carl Martin Reinthaler,"Carl Martin Reinthaler (13 October 1822 – 13 February 1896) was a German organist, conductor and composer."
Heinrich Reinhardt (composer),Heinrich Reinhardt (1865–1922) was an Austrian composer. He died on 31 January 1922 in Vienna and is buried at the Döbling Cemetery.
Carl Gottlieb Reissiger,"Carl Gottlieb Reißiger (also Karl Reissiger, Carl Reissiger, Karl Reißiger) (31 January 1798 – 7 November 1859) was a German Kapellmeister and composer."
Alfonso Rendano,"Alfonso Rendano (5 April 1853 – 10 September 1931)[1] was an Italian pianist and composer. He is mostly renowned for inventing the ""third pedal"", which augmented the interpretative resources of the piano."
Ede Reményi,"Ede Reményi or Eduard Reményi (January 17, 1828 Miskolc, Austria-Hungary –  May 15, 1898 San Francisco) was a Hungarian violinist and composer. His birth date is disputed, and variously given from 1828-1830."
Henriette Renié,"Henriette Renié (French: [ʁə.nje]; 18 September 1875 – 1 March 1956) was a French harpist and composer who is known for her many original compositions and transcriptions, as well as codifying a method for harp that is still used today. She was a musical prodigy who excelled in harp performance from a young age, advancing through her training rapidly and receiving several prestigious awards in her youth. She was an exceptional instructor and contributed to the success of many students. She gained prominence as a woman in an era where fame was socially unacceptable for women. Her devotion to her religion, her family, her students, and her music has continued to influence and inspire musicians for decades."
Catharina van Rennes,"Catharina van Rennes (2 August 1858, Utrecht – 23 September 1940, Amsterdam) was a Dutch music educator, soprano singer and composer."
Julius Reubke,"Friedrich Julius Reubke (23 March 1834 – 3 June 1858) was a German composer, pianist and organist. In his short life, he composed the Sonata on the 94th Psalm in C minor, which is considered to be one of the greatest organ works in the classical repertoire."
Prince Heinrich XXIV Reuss of Köstritz,"Prince Heinrich XXIV Reuss of Köstritz, also Prince Heinrich XXIV Reuss, Younger Line  (German: Heinrich XXIV. Prinz Reuß zu Köstritz, also Heinrich XXIV. Prinz Reuß jüngere Linie, December 8, 1855 in Trebschen – October 2, 1910 in Ernstbrunn, Austria) was a German composer."
Antonio Reparaz,Antonio Reparaz (3 October 1831 – 14 April 1886) was a Spanish composer who gained renown for the success of his many operas.
Emil von Reznicek,"Emil Nikolaus Joseph, Freiherr von Reznicek (4 May 1860, in Vienna – 2 August 1945, in Berlin) was an Austrian composer of Romanian-Czech ancestry."
Josef Rheinberger,"Josef Gabriel Rheinberger (17 March 1839 – 25 November 1901) was a Liechtensteiner organist and composer, residing in Germany for most of his life."
Federico Ricci,"Federico Ricci (22 October 1809 – 10 December 1877), was an Italian composer, particularly of operas. Born in Naples, he was the younger brother of Luigi Ricci, with whom he collaborated on several works."
Luigi Ricci (composer),"Luigi Ricci (8 July 1805 – 31 December 1859), was an Italian composer, particularly of operas. He was the elder brother of Federico Ricci, with whom he collaborated on several works.  He was also a conductor."
Caroline Ridderstolpe,"Caroline Johanna Lovisa Ridderstolpe, née Kolbe (September 2, 1793 – October 8, 1878) was a Swedish composer and singer."
Oskar Rieding,"Oskar Rieding (29 June 1846 in Banie, Pomerania, now Poland–7 July 1916 in Celje, Austria-Hungary, now Slovenia)[1] was a German violinist, teacher of music, and composer."
