title,paragraph
James Cooksey Culwick,"James Cooksey Culwick (28 April 1845 – 5 October 1907) was an English musician who is most well known for being organist of the Chapel Royal and founding the Orpheus Choir, both in Dublin, Ireland.[1] The Culwick Choral Society is both named in honour of Culwick and traces its lineage to the Orpheus Choir.[2]"
Alessandro Curmi,"Alessandro Curmi (17 October 1801 – April 1857) was a Maltese composer and pianist. Born in Valletta, he studied privately with Pietro Paolo Bugeja and then under Niccolò Antonio Zingarelli and Giacomo Tritto at the San Pietro a Maiella Conservatory in Naples from 1821 to 1827. He later became a member of Bologna's Accademia Filarmonica."
Adolphe Danhauser,"Adolphe-Léopold Danhauser (26 February 1835 – 9 June 1896) was a French musician, educator, music theorist and composer."
Franz Danzi,"Franz Ignaz Danzi (15 June 1763 – 13 April 1826) was a German cellist, composer and conductor, the son of the Italian cellist Innocenz Danzi (1730–1798) and brother of the noted singer Franzeska Danzi. Danzi lived at a significant time in the history of European music. His career, spanning the transition from the late Classical to the early Romantic styles, coincided with the origin of much of the music that lives in our concert halls and is familiar to contemporary classical-music audiences. As a young man he knew Wolfgang Amadeus Mozart, whom he revered; he was a contemporary of Ludwig van Beethoven, about whom he — like many of his generation — had strong but mixed feelings; and he was a mentor for the young Carl Maria von Weber, whose music he respected and promoted."
Alexander Dargomyzhsky,"Alexander Sergeyevich Dargomyzhsky (Russian: Александр Сергеевич Даргомыжский, tr. Aleksandr Sergeyevich Dargomyzhskiy[a], IPA: [ɐlʲɪkˈsandr sʲɪrˈɡʲe(j)ɪvʲɪdʑ dərɡɐˈmɨʂskʲɪj] (listen); 14 February [O.S. 2 February] 1813 – 17 January [O.S. 5 January] 1869) was a 19th-century Russian composer. He bridged the gap in Russian opera composition between Mikhail Glinka and the later generation of The Five and Pyotr Ilyich Tchaikovsky."
Henry Darondeau,"Henry Benoît François Darondeau (born as ""d'Arondeau"") (28 February 1779 – 30 July 1865) was a 19th-century French composer and piano teacher."
Louis François Dauprat,"Louis François Dauprat (24 May 1781 – 16 July 1868) was a French horn player, composer and professor at the Conservatoire de Paris. He played and taught natural horn only, but was also very interested in the first experiments with keyed horns. He successfully ensured the development of a distinctively French school of playing, marginally influenced by the invention of the valve horn.[1]"
Adam Darr,"Adam Darr (29 September 1811 – 2 October 1866)[1] was a German classical guitarist, singer, zither player and composer."
Charles Dancla,"(Jean Baptiste) Charles Dancla (19 December 1817 – 10 October 1907) was a French violinist, composer and teacher."
Joseph Daussoigne-Méhul,"Joseph Daussoigne-Méhul (10 June 1790 – 10 March 1875) was a French composer and music educator. He served as the first director of the Royal Conservatory of Liège from 1826–1862; having been appointed to that post by William I of the Netherlands. In addition to his duties as director, he also taught courses in harmony and composition at the school. Among his notable pupils were Adolphe Samuel, César Franck, and Jean-Théodore Radoux, the latter of whom succeeded him as conservatory director. In 1859, he was made a Commander of the Order of Leopold.[1]"
Alfred De Sève,"Alfred De Sève (May or June 1858 – 25 November 1927) was a Canadian violinist, composer, and music educator. His compositional output includes works for violin and piano, solo piano, and orchestra; many of which were published by Arthur P. Schmidt and Charles H. Ditson.[1]"
Ferdinand David (musician),Ferdinand Ernst Victor Carl David (German: [ˈdaːvɪt]; 19 June 1810 – 18 July 1873)[1] was a German virtuoso violinist and composer.
Karl Davydov,"Karl Yulievich Davydov (Russian: Карл Юльевич Давидов; 15 March [O.S. 3 March] 1838 – 26 February [O.S. 14 February] 1889) was a Russian cellist of great renown during his time, and described by Pyotr Ilyich Tchaikovsky as the ""czar of cellists"". He was also a composer, mainly for the cello. His name also appears in various different spellings: Davydov, Davidoff,  Davidov, and more, with his first name sometimes written as Charles or Carl."
William Dayas,"William Humphreys Dayas (12 September 1863,[1] New York – 3 May 1903, Manchester) was an American pianist, pedagogue and composer, one of the last pupils of Franz Liszt. Dayas lost his parents at an early age. He studied organ and composition and moved to Germany in 1881. After studies with Liszt, he taught at European conservatoires, including Helsinki (1890–1893), where his daughter, the pianist and pedagogue Karin Dayas (1892–1971) was born. After that he worked as a piano teacher in Germany, New York and finally as a professor at Royal Manchester College of Music. He composed piano pieces."
George Savin De Chanéet,"George Savin De Chaneet was a Hungarian-Australian composer, conductor, choir master, organist and music teacher.[1] He was born in Hamburg,[2] only son of Frederich de Chanéet.[3] He arrived in Melbourne on 22 April 1884, where he spent his active life, seeking naturalisation in 1899.[4]"
Delfina de la Cruz,"Delfina de la Cruz Zañartu (24 February 1837 Concepción, Chile – 8 May 1905 Concepción, Chile) was a Chilean pianist[1] and First Lady of Chile. She was the only child of General José María de la Cruz and his wife Josefa Zañartu, and granddaughter of Chilean revolutionary Luis de la Cruz."
Nicola De Giosa,"Nicola De Giosa (3 May 1819 – 7 July 1885) was an Italian composer and conductor active in Naples. He composed numerous operas, the most successful of which, Don Checco and Napoli di carnevale, were in the  Neapolitan opera buffa genre. His other works included sacred music and art songs. His songs were particularly popular, bringing him fame as a salon composer both in Italy and abroad. De Giosa died in Bari, the city of his birth, at the age of 66.[1]"
Félicien David,Félicien-César David (13 April 1810 – 29 August 1876) was a French composer.
Stepan Degtyarev,"Stepan Anikiyevich Degtyarev (Степан Аникиевич Дегтярёв) (1766 – 5 May 1813), was a renowned Russian composer of the late 18th century. He was most famous for his nationalistic Russian Choral Music."
Reginald De Koven,"Henry Louis Reginald De Koven (April 3, 1859 – January 16, 1920) was an American music critic and prolific composer, particularly of comic operas."
Camille Decreus,"Camille Léo Ernest Decreus (sometimes spelt as ""Camille DeCreus"" or ""Camille de Creus"") (23 September 1876 – 26 September 1939) was a French composer and pianist."
Serafino Amedeo De Ferrari,"Serafino Amedeo De Ferrari (6 May 1824 – 27 March 1885) was an Italian composer, conductor, organist, and pianist. He is best known for his operas, of which his most popular were Pipelè (1855) and Il Menestrello (1859)."
Louis Deffès,Pierre Louis Deffès (25 July 1819 – 28 May 1900) was a 19th-century French composer. He excelled as a composer of both operas and large-scale sacred music.
Édouard Deldevez,"Édouard Marie Ernest Deldevez (31 May 1817 – 6 November 1897) was a French violinist, conductor at important Parisian musical institutions, composer, and music teacher.[1]"
Maurice Delage,Maurice Charles Delage[1] (13 November 1879 – 19 or 21 September 1961)[1] was a French composer and pianist.
Claude Debussy,
Léo Delibes,"Clément Philibert Léo Delibes (French: [klemɑ̃ filibɛʁ leo dəlib]; 21 February 1836 – 16 January 1891) was a French Romantic composer, best known for his ballets and operas. His works include the ballets Coppélia (1870) and Sylvia (1876) and the opera Lakmé (1883), which includes the well-known ""Flower Duet""."
Charles Delioux,"Jean-Charles Delioux (de) Savignac (17 April 1825 – 12 November 1915) was a French composer, a pupil of Halévy and potentially Chopin, who was quite popular in the Paris salons of the nineteenth century."
Giuseppe Dell'Orefice,"Giuseppe Dell'Orefice (22 August 1848 – 3 January 1889) born in Fara Filiorum Petri, province of Chieti, was an Italian composer, and conductor best-remembered for his opera Romilda de'Bardi.[1] He died in Naples."
Gisella Delle Grazie,"Gisella Delle Grazie (born 1 June 1868; fl. 1894–95) was an Italian composer born in Trieste. Delle Grazie composed two operas, Atala (I Pellirossa), premiered at the Teatro Balbo in Turin in 1894, and La trecciaiuola di Firenze, premiered at the Teatro Filodrammatico in Trieste in 1895.[1]"
Frederick Delius,"Frederick Theodore Albert Delius CH (/ˈdiːliəs/ 29 January 1862 – 10 June 1934), originally Fritz Delius, was an English composer. Born in Bradford in the north of England to a prosperous mercantile family, he resisted attempts to recruit him to commerce. He was sent to Florida in the United States in 1884 to manage an orange plantation. He soon neglected his managerial duties and in 1886 returned to Europe."
Eva Dell'Acqua,Eva Dell'Acqua (28 January 1856 – 12 February 1930) was a Belgian singer and composer of Italian ancestry.
Sophia Dellaporta,"Sophia Dellaporta (fl. after 1850) was a Greek composer. She published a musical titled Recueil in Leipzig in 1877, including eight songs. The collection won a prize at the Third Greek Composers' Competition conducted in Athens at the 1875 Olympic Exhibition.[1]"
Rudolf Dellinger,"Rudolf Dellinger (8 July 1857 – 24 September, 1910) was a German Bohemian composer and Kapellmeister.[1] He almost exclusively composed operettas and was considered to be among the most outstanding composers of his time."
Josef Dessauer,"Josef Dessauer (28 May 1798 in Prague – 8 July 1876 in Mödling, near Vienna), was an Austrian-born composer who wrote many popular songs, and also some less successful operas."
Guillaume Despréaux,Guillaume Despréaux (20 September 1802 – 14 June 1865) was a French composer who won the Prix de Rome in 1828.
Felix Otto Dessoff,Felix Otto Dessoff (14 January 1835 – 28 October 1892) was a German conductor and composer.
Anton Diabelli,"Anton (or Antonio) Diabelli (5 September 1781 – 8 April 1858) was an Austrian music publisher, editor and composer. Best known in his time as a publisher, he is most familiar today as the composer of the waltz on which Ludwig van Beethoven wrote his set of thirty-three Diabelli Variations.[1]"
Jules Demersseman,Jules Auguste Demersseman (9 January 1833 – 1 December 1866) was a French flautist and composer.
Ellen Dickson,"Ellen (Elizabeth) Dickson (1819 – 4 July 1878), also known as Dolores, was an English ballad composer. She was born in Woolwich, England southeast of London. Ellen was the third daughter of General Sir Alexander Dickson. She had been physically disabled since a young age, and her chosen Latin pseudonym, Dolores, which means sorrows and bodily pains, reflects that aspect of her personal life.[1] Ellen inherited her father’s talents for mathematics and his analytical intellect.[2]"
Luigi Denza,Luigi Denza (24 February 1846 – 27 January 1922) was an Italian composer.[1]
Adolphe Deslandres,Adolphe Édouard Marie Deslandres (22 January 1840 – 30 July 1911) was a French composer and organist.
Louis Diémer,"Louis Joseph Diémer (14 February 1843 – 21 December 1919) was a French pianist and composer. He was the founder of the Société des Instruments Anciens in the 1890s, and also gave recitals on the harpsichord. His output as a composer was extensive, including a piano concerto and a quantity of salon pieces."
Theodor Döhler,"Baron Theodor  Döhler (20 April 1814 – 21 February 1856) was a German composer and a notable piano virtuoso of the Romantic period. He studied under Julius Benedict, Carl Czerny, and Simon Sechter.[1]"
Jakob Dont,"Jakob Dont (March 2, 1815 – November 17, 1888) was an Austrian violinist, composer, and teacher."
Pierre-Louis Dietsch,"Pierre-Louis-Philippe Dietsch (also Dietch, Dietzch, Dietz) (17 March 1808 – 20 February 1865) was a French composer and conductor,[1] perhaps best remembered for the much anthologized Ave Maria 'by' Jacques Arcadelt, which he loosely arranged from that composer's three part madrigal Nous voyons que les hommes.[1][2]"
Yeghia Dndesian,"Yeghia Dndesian (born Istanbul, Ottoman Turkey 1834 - died Constantinople, Ottoman Turkey 1881) was an Armenian musician and musical reformer.[1]"
Ignacy Feliks Dobrzyński,"Ignacy Feliks Dobrzyński (15 February 1807 – 9 October 1867) was a Polish pianist and composer. He was the son of Ignacy Dobrzyński, the brother of Edward Dobrzyński, and the father of Bronisław Dobrzyński."
Ernst von Dohnányi,"Ernst von Dohnányi (Hungarian: Dohnányi Ernő, [ˈɛrnøː ˈdohnaːɲi]; 27 July 1877 – 9 February 1960) was a Hungarian composer, pianist and conductor. He used a German form of his name on most published compositions.[1]"
Gaetano Donizetti,"Domenico Gaetano Maria Donizetti[a] (29 November 1797 – 8 April 1848) was an Italian composer, best known for his almost 70 operas. Along with Gioachino Rossini and Vincenzo Bellini, he was a leading composer of the bel canto opera style during the first half of the nineteenth century and a probable influence on other composers such as Giuseppe Verdi.[4] Donizetti was born in Bergamo in Lombardy. At an early age he was taken up by Simon Mayr[5] who enrolled him with a full scholarship in a school which he had set up. There he received detailed musical training. Mayr was instrumental in obtaining a place for Donizetti at the Bologna Academy, where, at the age of 19,[6] he wrote his first one-act opera, the comedy Il Pigmalione, which may never have been performed during his lifetime.[7]"
Franz Doppler,"Albert Franz Doppler (16 October 1821 – 27 July 1883), was a flute virtuoso and a composer best known for his flute music. He also wrote one German and several Hungarian operas for Budapest, all produced with great success. His ballet music was popular during his lifetime."
Gustave Doret,Gustave Doret (20 September 1866 – 19 April 1943) was a Swiss composer and conductor.
Árpád Doppler,Árpád Doppler (5 June 1857 – 13 August 1927) was a Hungarian-German composer.
Karl Doppler,"Karl Doppler (12 September 1825, Lemberg – 10 March 1900, Stuttgart) was a Hungarian flute virtuoso, conductor, music director, composer. He was the younger brother of the composer Franz Doppler and father of the composer Árpád Doppler."
Heinrich Dorn,"Heinrich Ludwig Egmont Dorn (14 November 1800[1] or 1804-10 January 1892) was a German conductor, composer, teacher, and journalist. He was born in Königsberg, where he studied piano, singing, and composition. Later, he studied in Berlin with Ludwig Berger, Bernhard Klein, and Carl Friedrich Zelter. His first opera, Rolands Knappen, was produced in 1826, and was a success. Around this time, he became co-editor of the Berliner allgemeine Musikzeitung."
Hermann Dostal,Hermann Dostal (1874 in Mährisch-Ostrau (today Moravská Ostrava) – 20 December 1930 in Vienna) was an Austrian composer and arranger.[1]
Friedrich Dotzauer,Justus Johann Friedrich Dotzauer (20 January 1783 – 6 March 1860) was a German cellist and composer.
František Doubravský,"František Doubravský (7 February 1790, Lomnice nad Popelkou – 28 April 1867, Lomnice nad Popelkou) was a Czech composer, choirmaster and organist."
John Thomas Douglass,"John Thomas Douglass (1847–1886) was an American composer, virtuoso violinist, conductor and teacher.[1] He is best known for composing Virginia's Ball (1868), which is generally regarded as the first opera written by a Black American composer. The work is now lost, and his only extant composition is The Pilgrim: Grand Overture (1878) for piano. His biography from James Monroe Trotter's Music and Some Highly Musical People (1878)—in which The Pilgrim survives—reports that he wrote many now lost pieces for piano, orchestra and particularly guitar, which he was known to play."
Victor Dourlen,"Victor Charles Paul Dourlen (3 November 1780 – 8 January 1864) was a French composer and music teacher at the Conservatoire de Paris during the first half of the nineteenth century. He is primarily known as a theorist on account of his treatises on harmony, based on the methods of Charles Simon Catel,[1] which were widely used as reference works, especially his Traité d'harmonie (c. 1838), the  Traité d'accompagnement pratique (c. 1840), and his Méthode élémentaire pour le pianoforte (c. 1820)."
Felix Draeseke,"Felix August Bernhard Draeseke (7 October 1835 – 26 February 1913) was a composer of the ""New German School"" admiring Franz Liszt and Richard Wagner. He wrote compositions in most forms including eight operas and stage works, four symphonies, and much vocal and chamber music.[1]"
Felix Dreyschock,"Felix Dreyschock (27 December 1860 in Leipzig – 1 August 1906 in Berlin) was a German pianist, nephew of Alexander Dreyschock.[1] He was a pupil of Friedrich Kiel, Wilhelm Taubert and Heinrich Ehrlich in Berlin,[2] where he in 1883 began to give concerts.[1] In Stockholm he performed successfully in 1886 and 1889, both as a virtuoso and composer. He wrote major and minor works for piano, violin, vocals, orchestra, etc."
Annette von Droste-Hülshoff,"Baroness Anna Elisabeth Franziska Adolphine Wilhelmine Louise Maria von Droste zu Hülshoff,[1] known as Annette von Droste-Hülshoff (German: [aˈnɛtə fɔn ˈdʁɔstəˈhʏlshɔf] (listen); 10 January[2] 1797 – 24 May 1848[3]), was a 19th-century German poet, novelist, and composer of Classical music. She was also the author of the novella Die Judenbuche."
Johann Dubez,"Johann Dubez (1828 – 27 October 1891) was an Austrian  composer and virtuoso of mandolin, guitar, harp and zither."
Alexander Dreyschock,Alexander Dreyschock (15 October 1818 – 1 April 1869) was a Czech pianist and composer.
Learmont Drysdale,"Learmont Drysdale (full name George John Learmont Drysdale; 3 October 1866 – 18 June 1909) was a Scottish composer. During a short career he wrote music inspired by Scotland, particularly the Scottish Borders; this included orchestral music, choral music and songs."
Alexandre Dubuque,"Alexandre Ivanovich Dubuque, also Alexander and Dubuc (Russian: Алекса́ндр Ива́нович Дюбю́к; Aleksandr Ivanovich Diubiuk; 3 March [O.S. 20 February] 1812  – 8 January 1898 [O.S. 27 December 1897]),[1][2] was a 19th-century Russian pianist, composer and teacher of French descent."
Pauline Duchambge,"Pauline Duchambge née de Montet (1778 – 23 April 1858) was a French pianist, singer, and composer."
Paul Dukas,"Paul Abraham Dukas (French: [dykas] or French: [dyka];[1] 1 October 1865 – 17 May 1935) was a French composer, critic, scholar and teacher. A studious man of retiring personality, he was intensely self-critical, having abandoned and destroyed many of his compositions. His best-known work is the orchestral piece The Sorcerer's Apprentice (L'apprenti sorcier), the fame of which has eclipsed that of his other surviving works. Among these are the opera Ariane et Barbe-bleue, his Symphony in C and Piano Sonata in E-flat minor, the Variations, Interlude and Finale on a Theme by Rameau (for solo piano), and a ballet, La Péri."
Thomas Dunhill,"Thomas Frederick Dunhill (1 February 1877 – 13 March 1946) was a prolific English composer in many genres, though he is best known today for his light music and educational piano works. His compositions include much chamber music, a song cycle, The Wind Among the Reeds, and an operetta, Tantivy Towers, that had a successful London run in 1931. He was also a teacher, examiner and writer on musical subjects."
Henri Duparc (composer),Eugène Marie Henri Fouques Duparc (21 January 1848 – 12 February 1933) was a French composer of the late Romantic period.
Alette Due,"Alethe ""Alette"" Wilhelmine Georgine Due, née Sibbern (28 February 1812, Værne Kloster – 7 May 1887, Oslo), was a Norwegian singer, composer and courtier. She was an honorary member of the Royal Swedish Academy of Music, and served as Overhoffmesterinne for Queen Sophia of Norway in 1873–1887."
Théodore Dubois,"Clément François Théodore Dubois (24 August 1837 – 11 June 1924) was a French Romantic composer, organist, and music teacher."
Jean-Baptiste Duvernoy,"Jean-Baptiste Duvernoy (c. 1802 – c. 1880) was a French pianist and composer of the Romantic period. He is best known for his Elementary Studies, Op. 176, designed to improve finger co-ordination. He is also known for The School of Mechanism, Op. 120."
Gabriel Dupont,"Gabriel Édouard Xavier Dupont (1 March 1878 – 1 August 1914) was a French composer, known for his operas and chamber music."
Édouard Du Puy,"Jean Baptiste Édouard Louis Camille Du Puy  (1770 – 3 April 1822) was a Swiss-born singer, composer, director, and violinist. He lived and worked in Copenhagen and Stockholm from 1793 until his death in 1822."
August Duranowski,August (Fryderyk) Duranowski (originally Auguste Frédéric Durand) (c 1770–1834) was a Polish-born French violinist and composer.
Sophia Dussek,"Sophia Giustina Dussek (née Corri; later Moralt; Edinburgh, 1 May 1775 – London, ca. 1831)[1] was a Scottish singer, pianist, harpist, and composer of Italian descent."
Katerina Veronika Anna Dusíkova,"Katerina Veronika Anna Dusíková (8 March 1769 – 24 March 1833) was a Bohemian singer, harpist, pianist and composer. She was also known as Veronika Rosalia Dusik (Dussek), Veronika Elisabeta Dusíková and Veronica Cianchettini. She was born in Čáslav, Bohemia, and began her studies in music with her organist father Jan Josef Dusik. She later moved to London to stay with her brother, composer Jan Ladislav Dusik, and married music publisher Francesco Cianchettini. She died in London in 1833.[1][2]"
Jan Ladislav Dussek,"Jan Ladislav Dussek (baptized Jan Václav Dusík,[1] with surname also written as Duschek or Düssek; 12 February 1760 – 20 March 1812) was a Czech composer and pianist. He was an important representative of Czech music abroad in the second half of the 18th century and the beginning of the 19th century. Some of his more forward-looking piano works have traits often associated with Romanticism.[2]"
Alphonse Duvernoy,Victor-Alphonse Duvernoy (pronounced [viktɔʁ alfɔ̃s dyvɛʁnwa]; 30 August 1842 – 7 March 1907) was a French pianist and composer.
Karl Anton Eckert,Karl Anton Florian Eckert (17 December 1820 – 14 October 1879) was a German conductor and composer.
Lotten Edholm,"Lovisa Christina Charlotta ""Lotten"" Edholm or af Edholm, née von Heijne (18 April 1839 - 12 July 1930) was a Swedish composer and a pioneer within the Swedish Red Cross."
Julian Edwards,"Julian Edwards (December 11, 1855 - September 5, 1910) was an English composer of light operatic music, who composed many successful Broadway shows in the Progressive Era. He attempted to introduce new levels of musical sophistication to the genre. Some of his songs achieved popularity at the time."
Fredrikke Egeberg,Fredrikke Egeberge (23 November 1815 – 16 May 1861) was a Norwegian pianist and composer.
Joachim Nicolas Eggert,Joachim Nicolas Eggert (22 February 1779 – 14 April 1813) was a Swedish composer and musical director.
Antonín Dvořák,"Antonín Leopold Dvořák (/d(ə)ˈvɔːrʒɑːk, -ʒæk/ d(ə-)VOR-zha(h)k; Czech: [ˈantoɲiːn ˈlɛopold ˈdvor̝aːk] (listen); 8 September 1841 – 1 May 1904) was a Czech composer, one of the first Czech composers to achieve worldwide recognition. Dvořák frequently employed rhythms and other aspects of the folk music of Moravia and his native Bohemia, following the Romantic-era nationalist example of his predecessor Bedřich Smetana. Dvořák's style has been described as ""the fullest recreation of a national idiom with that of the symphonic tradition, absorbing folk influences and finding effective ways of using them"".[1]"
Riccardo Drigo,"Riccardo Eugenio Drigo (ru. Риккардо Эудженьо Дриго) (30 June 1846 – 1 October 1930) was an Italian composer of ballet music and Italian opera, a theatrical conductor, and a pianist."
Heinrich Ehrlich,"Alfred Heinrich Ehrlich (5 October 1822, in Vienna – 30 December 1899, in Berlin) was a pianist, composer and writer on music. As a composer, he came forward with a Piano Concerto and Piano Variations on an Original Theme, being one of the first composers to collect Romanian folk melodies."
Julius Eichberg,"Julius Eichberg (13 June 1824 – 19 January 1893) was a German-born composer, musical director and educator who worked mostly in Boston, Massachusetts."
Konstantin Eiges,"Konstantin Romanovich Eiges (surname sometimes spelt Eyges, Russian Константин Романович Эйгес,  24 May (Old Style)/ 5 June 1875—2 Dec 1950) was a Russian composer, teacher and pianist."
Richard Eilenberg,Richard Eilenberg (13 January 1848 – 5 December 1927) was a German composer.
Louis Ehlert,Louis Ehlert (23 January 1825 – 4 January 1884) was a German composer and music critic.
Béni Egressy,"Béni Egressy (Hungarian pronunciation: [ˈbeːni ˈɛɡrɛʃi]; born Galambos Benjámin; 21 April 1814 – 17 July 1851 in Sajókazinc) was a Hungarian composer, librettist, translator and actor. He created a number of popular melodic compositions, including the one to Mihály Vörösmarty's patriotic poem Szózat.[1] He also authored the librettos of the operas Hunyadi László and Bánk bán by Ferenc Erkel."
